{
  "act_id": "ACT-LEAMAS-FACTORY-CLOSURE-PROTOCOL-V2-VERIFIER-MAC-HANDOFF01",
  "artifacts": [],
  "baseline": {
    "commit_oid": "82feec42bfa85711cbb2f9f2e5729f84115dce79",
    "tree_oid": "7291a313fd81e296eb6af92a5f39877adf10ef89"
  },
  "checks": [
    {
      "argv": ["go", "test", "-count=1", "-run", "TestV2Verifier|TestV2CallerState|TestClosureCLIV2VerifierMacHandoff", "./internal/factory/closure/...", "./cmd/leamas/..."],
      "environment": {"CGO_ENABLED": "0"},
      "id": "v2-verifier-mac-handoff-focused-tests",
      "mode": "run",
      "timeout_seconds": 600,
      "working_directory": "."
    },
    {
      "argv": ["go", "test", "-count=1", "-run", "TestClosureCLIV2VerifierMacHandoff", "./cmd/leamas/..."],
      "environment": {"CGO_ENABLED": "0"},
      "id": "v2-verifier-mac-handoff-dogfood",
      "mode": "run",
      "timeout_seconds": 600,
      "working_directory": "."
    },
    {
      "argv": ["go", "vet", "./..."],
      "environment": {"CGO_ENABLED": "0"},
      "id": "v2-verifier-mac-handoff-vet",
      "mode": "run",
      "timeout_seconds": 180,
      "working_directory": "."
    },
    {
      "argv": ["gofmt", "-l", "cmd/leamas/factory_close_v2_verifier_mac_handoff_test.go"],
      "environment": {},
      "id": "v2-verifier-mac-handoff-gofmt",
      "mode": "run",
      "timeout_seconds": 30,
      "working_directory": "."
    },
    {
      "argv": ["git", "diff", "--check"],
      "environment": {},
      "id": "v2-verifier-mac-handoff-diff-check",
      "mode": "run",
      "timeout_seconds": 30,
      "working_directory": "."
    },
    {
      "argv": ["go", "build", "-trimpath", "-o", "/tmp/leamas-v2verifier-mac-handoff", "./cmd/leamas"],
      "environment": {"CGO_ENABLED": "0"},
      "id": "v2-verifier-mac-handoff-static-build",
      "mode": "run",
      "timeout_seconds": 120,
      "working_directory": "."
    }
  ],
  "execution": {
    "mode": "serial_fail_fast"
  },
  "policy": {
    "require_clean_before": true,
    "require_clean_after": true,
    "forbid_tracked_full_digests": true,
    "require_diff_check": true
  },
  "contract_version": 1
}
