{
  "act_id": "ACT-LEAMAS-FACTORY-CLOSURE-PROTOCOL-V2-VERIFIER-CLI-TAG-STATE01",
  "artifacts": [],
  "baseline": {
    "commit_oid": "dea6655ce60a40bf16ace5da448659efbc8c381a",
    "tree_oid": "cb0621c6278d6e0aca2fef9a57c1e1aace5464da"
  },
  "checks": [
    {
      "argv": ["go", "test", "-count=1", "-run", "TestV2Verifier|TestV2CallerState", "./internal/factory/closure/..."],
      "environment": {"CGO_ENABLED": "0"},
      "id": "v2-verifier-focused-tests",
      "mode": "run",
      "timeout_seconds": 300,
      "working_directory": "."
    },
    {
      "argv": ["go", "test", "-count=1", "./internal/factory/closure/..."],
      "environment": {"CGO_ENABLED": "0"},
      "id": "v2-verifier-package-tests",
      "mode": "run",
      "timeout_seconds": 600,
      "working_directory": "."
    },
    {
      "argv": ["go", "vet", "./..."],
      "environment": {"CGO_ENABLED": "0"},
      "id": "v2-verifier-vet",
      "mode": "run",
      "timeout_seconds": 180,
      "working_directory": "."
    },
    {
      "argv": ["gofmt", "-l", "internal/factory/closure/v2_verifier_diagnostic.go", "internal/factory/closure/v2_verifier_format.go", "internal/factory/closure/v2_verifier_manifest.go", "internal/factory/closure/v2_verifier_orchestrator.go", "internal/factory/closure/v2_verifier_request.go", "internal/factory/closure/v2_verifier_result.go", "internal/factory/closure/v2_verifier_state.go", "internal/factory/closure/v2_verifier_tag.go", "internal/factory/closure/v2_verifier_topology.go", "internal/factory/closure/v2_verifier_validate.go", "cmd/leamas/factory_close_v2_verifier_cli.go"],
      "environment": {},
      "id": "v2-verifier-gofmt",
      "mode": "run",
      "timeout_seconds": 30,
      "working_directory": "."
    },
    {
      "argv": ["git", "diff", "--check"],
      "environment": {},
      "id": "v2-verifier-diff-check",
      "mode": "run",
      "timeout_seconds": 30,
      "working_directory": "."
    },
    {
      "argv": ["go", "build", "-trimpath", "-o", "/tmp/leamas-v2verifier-cli", "./cmd/leamas"],
      "environment": {"CGO_ENABLED": "0"},
      "id": "v2-verifier-static-build",
      "mode": "run",
      "timeout_seconds": 120,
      "working_directory": "."
    }
  ],
  "execution": {
    "mode": "serial_fail_fast"
  },
  "policy": {
    "require_clean_before": true,
    "require_clean_after": true,
    "forbid_tracked_full_digests": true,
    "require_diff_check": true
  },
  "contract_version": 1
}
