{
  "act_id": "ACT-LEAMAS-FACTORY-CLOSURE-PROTOCOL-V2-VERIFIER-TOPOLOGY-OBJECTS01",
  "artifacts": [],
  "baseline": {
    "commit_oid": "279f8f573d9d58fbc6a3a517221a3844371ddf92",
    "tree_oid": "1a320f67bf3a40dd4e2ef795c55ba5013bd6ca6e"
  },
  "checks": [
    {
      "argv": ["go", "test", "-count=1", "-run", "TestV2Verifier", "./internal/factory/closure/..."],
      "environment": {"CGO_ENABLED": "0"},
      "id": "v2-verifier-focused-tests",
      "mode": "run",
      "timeout_seconds": 300,
      "working_directory": "."
    },
    {
      "argv": ["go", "test", "-count=1", "./internal/factory/closure/..."],
      "environment": {"CGO_ENABLED": "0"},
      "id": "v2-verifier-package-tests",
      "mode": "run",
      "timeout_seconds": 600,
      "working_directory": "."
    },
    {
      "argv": ["go", "vet", "./..."],
      "environment": {"CGO_ENABLED": "0"},
      "id": "v2-verifier-vet",
      "mode": "run",
      "timeout_seconds": 180,
      "working_directory": "."
    },
    {
      "argv": ["gofmt", "-l", "internal/factory/closure/v2_verifier_authority.go", "internal/factory/closure/v2_verifier_authority_test.go", "internal/factory/closure/v2_verifier_diagnostic.go", "internal/factory/closure/v2_verifier_format.go", "internal/factory/closure/v2_verifier_objects_test.go", "internal/factory/closure/v2_verifier_request.go", "internal/factory/closure/v2_verifier_self_reference_test.go", "internal/factory/closure/v2_verifier_topology.go", "internal/factory/closure/v2_verifier_topology_test.go", "internal/factory/closure/v2_verifier_validate.go"],
      "environment": {},
      "id": "v2-verifier-gofmt",
      "mode": "run",
      "timeout_seconds": 30,
      "working_directory": "."
    },
    {
      "argv": ["git", "diff", "--check"],
      "environment": {},
      "id": "v2-verifier-diff-check",
      "mode": "run",
      "timeout_seconds": 30,
      "working_directory": "."
    },
    {
      "argv": ["go", "build", "-trimpath", "-o", "/tmp/leamas-v2verifier-topology", "./cmd/leamas"],
      "environment": {"CGO_ENABLED": "0"},
      "id": "v2-verifier-static-build",
      "mode": "run",
      "timeout_seconds": 120,
      "working_directory": "."
    }
  ],
  "execution": {
    "mode": "serial_fail_fast"
  },
  "policy": {
    "require_clean_after": true,
    "require_clean_before": true,
    "forbid_tracked_full_digests": true,
    "require_diff_check": true
  },
  "contract_version": 1
}