{
  "act_id": "ACT-LEAMAS-FACTORY-CLOSURE-PROTOCOL-V2-RUNNER-AUTHORITY-CORRECTION01",
  "artifacts": [],
  "baseline": {
    "commit_oid": "b7762ad23a168558268340e13f0f35dde7238ab0",
    "tree_oid": "351256a99405e034c9e6db0ec23c6fb7a2b5e299"
  },
  "checks": [
    {
      "argv": ["go", "test", "-count=1", "-run", "TestV2", "./internal/factory/closure/..."],
      "environment": {"CGO_ENABLED": "0"},
      "id": "v2-corrected-focused-tests",
      "mode": "run",
      "timeout_seconds": 300,
      "working_directory": "."
    },
    {
      "argv": ["go", "vet", "./..."],
      "environment": {"CGO_ENABLED": "0"},
      "id": "v2-corrected-vet",
      "mode": "run",
      "timeout_seconds": 120,
      "working_directory": "."
    }
  ],
  "execution": {
    "mode": "serial_fail_fast"
  },
  "policy": {
    "require_clean_after": true,
    "require_clean_before": true,
    "forbid_tracked_full_digests": true,
    "require_diff_check": true
  },
  "contract_version": 1
}
