{
  "contract_version": 1,
  "act_id": "ACT-LEAMAS-FACTORY-CLOSURE-PROTOCOL-V2-ONE-SUBJECT-ONE-CLOSURE01",
  "baseline": {
    "commit_oid": "910f34dee65114575d7f1cdc0a57cfe76b65edeb",
    "tree_oid": "04651a4a27fbfeb3879d68fb33f00b1c1edffaf4"
  },
  "execution": {
    "mode": "serial_fail_fast"
  },
  "checks": [
    {
      "id": "go-test-count-1",
      "mode": "run",
      "argv": [
        "go",
        "test",
        "-count=1",
        "./internal/factory/closure/...",
        "./internal/factory/authority/...",
        "./internal/factory/digest/...",
        "./cmd/leamas/..."
      ],
      "environment": {
        "CGO_ENABLED": "0"
      },
      "working_directory": ".",
      "timeout_seconds": 600
    },
    {
      "id": "gate-fast",
      "mode": "run",
      "argv": [
        "make",
        "gate-fast"
      ],
      "environment": {
        "CGO_ENABLED": "0"
      },
      "working_directory": ".",
      "timeout_seconds": 600
    },
    {
      "id": "subject-diff-check",
      "mode": "run",
      "argv": [
        "git",
        "diff",
        "--check",
        "HEAD^..HEAD"
      ],
      "environment": {
        "CGO_ENABLED": "0"
      },
      "working_directory": ".",
      "timeout_seconds": 60
    },
    {
      "id": "dupcode",
      "mode": "exclude",
      "reason": "No dupcode-owned source or registration changed by this ACT."
    },
    {
      "id": "race-and-stress-long-lane",
      "mode": "exclude",
      "reason": "Repeated and race verification belongs to the non-interactive long lane and is not required for editor-driven Closure Protocol v2 qualification."
    }
  ],
  "artifacts": [],
  "policy": {
    "require_clean_before": true,
    "require_clean_after": true,
    "forbid_tracked_full_digests": true,
    "require_diff_check": true
  },
  "policy_profile": "leamas-act-v1"
}
